,Speaker 1,Speaker 2
279,Que faire fous là tout seul ?,"J’attends mes Gens, Messieurs."
280,"Li est belle, par mon foi.","Doucement, Messieurs."
281,"Fous, Mameselle, fouloir finir réchouir fous à la Crève ? Nous faire foir à fous un petit pendement pien choli.",Je vous rends grâce.
282,"L’est un Gentilhomme Limossin qui sera pendu chantiment, à un grand potence.",Je n’ai pas de curiosité.
283,Li est là un petit teton qui l’est drole.,Tout beau.
284,"Mon foy, moi couchair pien avec fous.","Ah c’en est trop, et ces sortes d’ordures-là ne se disent point à une Femme de ma condition."
285,"Laisse, toi, l’est moi qui le veut couchair avec elle.",Moy ne vouloir pas laisser.
286,"Moi li vouloir, moi.",Moi ne faire rien.
287,Toi l’avoir menti.,Toi l’avoir menty toi-même.
288,"Au secours, à la force.","Qu’est-ce ? quelle violence est-ce là ? et que voulez-vous faire à Madame ? Allons, que l’on sorte de là, si vous ne voulez que je vous mette en prison."
289,"Parti pon, toi ne l’afoir point.","Parti pon aussi, toi ne l’afoir point encore."
290,"Je vous suis bien obligée, Monsieur, de m’avoir délivrée de ces insolents.","Ouais, voilà un visage qui ressemble bien à celui que l’on m’a dépeint."
291,"Ce n’est pas moi, je vous assure.","Ah, ah ! qu’est-ce que je veux dire ?"
292,Je ne sais pas.,Pourquoi donc dites-vous cela ?
293,Pour rien.,"Voilà un discours qui marque quelque chose, et je vous arrête prisonnier."
294,"Eh, Monsieur, de grâce.","Non, non : à votre mine, et à vos discours, il faut que vous soyez ce Monsieur de Pourceaugnac que nous cherchons, qui se soit déguisé de la sorte ; et vous viendrez en prison tout à l’heure."
295,Hélas !,Ah Ciel ! que veut dire cela ?
296,Ils m’ont reconnu.,"Oui, oui, c’est de quoi je suis ravi."
297,"Eh ! Monsieur, pour l’amour de moi : vous savez que nous sommes Amis il y a longtemps ; je vous conjure de ne le point mener en prison.",Non ; il m’est impossible.
298,Vous êtes Homme d’accommodement ; n’y a-t-il pas moyen d’ajuster cela avec quelques Pistoles ?,Retirez-vous un peu.
299,Il faut lui donner de l’argent pour vous laisser aller ; Faites vite.,Ah maudite Ville !
300,"Tenez, Monsieur.",Combien y a-t-il ?
301,"Un, deux, trois, quatre, cinq, six, sept, huit, neuf, dix.","Non, mon ordre est trop exprès."
302,"Mon Dieu attendez. Dépêchez, donnez-lui-en encore autant.",Mais…
303,"Dépêchez-vous, vous dis-je, et ne perdez point de temps : Vous auriez un grand plaisir, quand vous seriez pendu.",Ah !
304,"Tenez, Monsieur.","Il faut donc que je m’enfuie avec lui, car il n’y aurait point ici de sûreté pour moi. Laissez-le-moi conduire, et ne bougez d’ici."
305,Je vous prie donc d’en avoir un grand soin.,"Je vous promets de ne le point quitter, que je ne l’aie mis en lieu de sûreté."
306,Adieu. Voilà le seul honnête Homme que j’ai trouvé en cette Ville.,"Ne perdez point de temps ; je vous aime tant, que je voudrais que vous fussiez déjà bien loin. Que le Ciel te conduise ! Par ma foi, voilà une grande dupe. Mais voici…"
307,"Ah ! quelle étrange aventure ! quelle fâcheuse nouvelle pour un Père ! Pauvre Oronte, que je te plains ! Que diras-tu ? et de quelle façon pourras-tu supporter cette douleur mortelle ?",Qu’est-ce ? quel malheur me présages-tu ?
308,"Ah ! Monsieur, ce perfide de Limosin, ce traître de Monsieur de Pourceaugnac vous enlève votre Fille.",Il m’enlève ma Fille !
309,"Oui ; elle en est devenue si folle, qu’elle vous quitte pour le suivre ; et l’on dit qu’il a un Caractère pour se faire aimer de toutes les Femmes.",Allons vite à la Justice. Des Archers après eux.
310,"Allons, vous viendrez malgré vous, et je veux vous remettre entre les mains de votre Père. Tenez, Monsieur, voilà votre Fille que j’ai tirée de force d’entre les mains de l’Homme avec qui elle s’enfuyait ; non pas pour l’amour d’elle, mais pour votre seule considération : car après l’action qu’elle a faite, je dois la mépriser, et me guérir absolument de l’amour que j’avais pour elle.",Ah infâme que tu es !
311,"Comment ? me traiter de la sorte, après toutes les marques d’amitié que je vous ai données ! Je ne vous blâme point de vous être soumise aux volontés de Monsieur votre Père ; il est sage et judicieux dans les choses qu’il fait, et je ne me plains point de lui de m’avoir rejeté pour un autre. S’il a manqué à la parole qu’il m’avait donnée, il a ses raisons pour cela. On lui a fait croire que cet autre est plus riche que moi de quatre ou cinq mille écus ; et quatre ou cinq mille écus est un denier considérable, et qui vaut bien la peine qu’un Homme manque à sa parole : Mais oublier en un moment toute l’ardeur que je vous ai montrée, vous laisser d’abord enflammer d’amour pour un nouveau venu, et le suivre honteusement sans le consentement de Monsieur votre Père, après les crimes qu’on lui impute, c’est une chose condamnée de tout le monde, et dont mon cœur ne peut vous faire d’assez sanglants reproches.","Hé bien ! oui, j’ai conçu de l’amour pour lui, et je l’ai voulu suivre, puisque mon Père me l’avait choisi pour Époux. Quoi que vous me disiez, c’est un fort honnête Homme ; et tous les crimes dont on l’accuse, sont faussetés épouvantables."
312,"Taisez-vous ! Vous êtes une impertinente, et je sais mieux que vous ce qui en est.","Ce sont sans doute des pièces qu’on lui fait, et c’est peut-être lui qui a trouvé cet artifice pour vous en dégoûter."
313,"Moi, je serais capable de cela !","Oui, vous."
314,"Taisez-vous, vous dis-je ? vous êtes une sotte.","Non, non, ne vous imaginez pas que j’aie aucune envie de détourner ce Mariage, et que ce soit ma passion qui m’ait forcé à courir après vous. Je vous l’ai déjà dit, ce n’est que la seule considération que j’ai pour Monsieur votre Père, et je n’ai pu souffrir qu’un honnête Homme comme lui fût exposé à la honte de tous les bruits qui pourraient suivre une action comme la vôtre."
315,"Je vous suis, Seigneur Éraste, infiniment obligé.","Adieu, Monsieur, j’avais toutes les ardeurs du monde d’entrer dans votre Alliance ; j’ai fait tout ce que j’ai pu pour obtenir un tel honneur, mais j’ai été malheureux, et vous ne m’avez pas jugé digne de cette grâce. Cela n’empêchera pas que je ne conserve pour vous les sentiments d’estime et de vénération où votre Personne m’oblige ; et si je n’ai pu être votre Gendre, au moins serai-je éternellement votre Serviteur."
316,"Arrêtez, Seigneur Éraste ; votre procédé me touche l’âme, et je vous donne ma Fille en mariage.",Je ne veux point d’autre Mari que Monsieur de Pourceaugnac.
317,"Et je veux, moi, tout à l’heure, que tu prennes le Seigneur Éraste. Çà, la main.","Non, je n’en ferai rien."
318,Je te donnerai sur les oreilles.,"Non, non, Monsieur, ne lui faites point de violence, je vous en prie."
319,"C’est à elle à m’obéir, et je sais me montrer le Maître.","Ne voyez-vous pas l’amour qu’elle a pour cet Homme-là ? Et voulez-vous que je possède un Corps, dont un autre possédera le cœur ?"
320,"C’est un sortilège qu’il lui a donné, et vous verrez qu’elle changera de sentiment avant qu’il soit peu. Donnez-moi votre main. Allons.",Je ne…
321,"Ah que de bruit. Çà, votre main, vous dis-je. Ah, ah, ah.","Ne croyez pas que ce soit pour l’amour de vous que je vous donne la main ; ce n’est que de Monsieur votre Père dont je suis amoureux, et c’est lui que j’épouse."
322,"Je vous suis beaucoup obligé, et j’augmente de dix mille écus le Mariage de ma Fille. Allons, qu’on fasse venir le Notaire pour dresser le Contrat.","En attendant qu’il vienne, nous pouvons jouir du divertissement de la Saison, et faire entrer les Masques que le bruit des Noces de Monsieur de Pourceaugnac a attirés ici de tous les endroits de la Ville."
